Title,Description,URL,Tag
Introduction to Programming,Not Available,https://www.udacity.com/course/intro-to-programming-nanodegree--nd000,Udacity
Programming for Data Science with Python,Not Available,https://www.udacity.com/course/programming-for-data-science-nanodegree--nd104,Udacity
Introduction to Machine Learning on AWS,"Introduction to Machine Learning on AWS Course by Amazon Web Services, 4.5 stars, by 129 reviews, provide skills AWS SageMaker, Artificial Intelligence and Machine Learning (AI/ML), Amazon Web Services etc... Beginner level, 1 - 4 Weeks",https://www.coursera.org/learn/machine-learning-on-aws,Coursera
AI Concepts and Strategy,"AI Concepts and Strategy Course by Rutgers the State University of New Jersey, 4.4 stars, by 13 reviews, provide skills OpenAI, Generative AI, Artificial Intelligence etc... Beginner level, 1 - 4 Weeks",https://www.coursera.org/learn/ai-strategy,Coursera
"Improving Deep Neural Networks: Hyperparameter Tuning, Regularization and Optimization","Improving Deep Neural Networks: Hyperparameter Tuning, Regularization and Optimization Course by DeepLearning.AI, 4.9 stars, by 63K reviews, provide skills Tensorflow, Deep Learning, Artificial Intelligence and Machine Learning (AI/ML) etc... Intermediate level, 1 - 4 Weeks",https://www.coursera.org/learn/deep-neural-network,Coursera
Introduction to Generative AI - Español,"Introduction to Generative AI - Español free Course by Google Cloud, 4.6 stars, by 212 reviews, provide skills Generative AI, Application Development, Artificial Intelligence etc... Beginner level, 1 - 4 Weeks",https://www.coursera.org/learn/introduction-to-generative-ai---locales,Coursera
Programming for Data Science with Python,Not Available,https://www.udacity.com/course/programming-for-data-science-nanodegree--nd104,Udacity
Front End Web Developer,Not Available,https://www.udacity.com/course/front-end-web-developer-nanodegree--nd0011,Udacity
Landing.AI for Beginners: Build Data Visualization AI Models,"Landing.AI for Beginners: Build Data Visualization AI Models free Course by Coursera Project Network, 5.0 stars, provide skills Generative AI, Image Analysis, Application Deployment etc... Beginner level, 1 - 4 Weeks",https://www.coursera.org/learn/landing-ai-for-beginners-build-data-visualization-ai-models,Coursera
AI for Business: Generation & Prediction,"AI for Business: Generation & Prediction free Course by Coursera Instructor Network, 4.5 stars, by 78 reviews, provide skills Generative AI, Artificial Intelligence, Strategic Thinking etc... Beginner level, 1 - 4 Weeks",https://www.coursera.org/learn/ai-for-business-generation-and-prediction,Coursera
Microsoft AI & ML Engineering,"Microsoft AI & ML Engineering new Professional Certificate by Microsoft, 4.6 stars, by 57 reviews, provide skills Unsupervised Learning, Generative AI, Data Management etc... Intermediate level, 3 - 6 Months",https://www.coursera.org/professional-certificates/microsoft-ai-and-ml-engineering,Coursera
AI in Education: Leveraging ChatGPT for Teaching,"AI in Education: Leveraging ChatGPT for Teaching new Course by University of Pennsylvania, 4.7 stars, by 99 reviews, provide skills Data Ethics, ChatGPT, Generative AI etc... Beginner level, 1 - 4 Weeks",https://www.coursera.org/learn/wharton-ai-in-education-leveraging-chatgpt-for-teaching,Coursera
Computer Vision,Not Available,https://www.udacity.com/course/computer-vision-nanodegree--nd891,Udacity
Data Engineering with AWS,Not Available,https://www.udacity.com/course/data-engineer-nanodegree--nd027,Udacity
AI for Mechanical Engineers,"AI for Mechanical Engineers new Specialization by University of Michigan, 4.4 stars, by 19 reviews, provide skills Artificial Intelligence and Machine Learning (AI/ML), Generative AI, Machine Learning etc... Intermediate level, 1 - 3 Months",https://www.coursera.org/specializations/ai-for-mechanical-engineers,Coursera
Exam Prep AI-102: Microsoft Azure AI Engineer Associate,"Exam Prep AI-102: Microsoft Azure AI Engineer Associate Course by Whizlabs, 3.3 stars, by 18 reviews, provide skills Microsoft Azure, Data Ethics, Natural Language Processing etc... Intermediate level, 1 - 3 Months",https://www.coursera.org/learn/ai-102-microsoft-azure-ai-engineer-associate-course,Coursera
AI for Medicine,"AI for Medicine Specialization by DeepLearning.AI, 4.7 stars, by 2.4K reviews, provide skills Deep Learning, Statistical Analysis, Clinical Trials etc... Intermediate level, 1 - 3 Months",https://www.coursera.org/specializations/ai-for-medicine,Coursera
Prompt Engineering for Law,"Prompt Engineering for Law Specialization by Vanderbilt University, 4.8 stars, by 5.2K reviews, provide skills ChatGPT, Generative AI, OpenAI etc... Beginner level, 1 - 3 Months",https://www.coursera.org/specializations/prompt-engineering-for-law,Coursera
Generative AI for Leaders,"Generative AI for Leaders Course by Vanderbilt University, 4.8 stars, by 365 reviews, provide skills Succession Planning, Business Writing, Generative AI etc... Beginner level, 1 - 4 Weeks",https://www.coursera.org/learn/generative-ai-for-leaders,Coursera
AI Programming with Python,Not Available,https://www.udacity.com/course/ai-programming-python-nanodegree--nd089,Udacity
AI Foundations for Everyone,"AI Foundations for Everyone Specialization by IBM, 4.7 stars, by 23K reviews, provide skills ChatGPT, Generative AI, Artificial Intelligence etc... Beginner level, 3 - 6 Months",https://www.coursera.org/specializations/ai-foundations-for-everyone,Coursera
Artificial Intelligence (AI) Education for Teachers,"Artificial Intelligence (AI) Education for Teachers free Course by Macquarie University, IBM, 4.7 stars, by 812 reviews, provide skills Computational Thinking, Design Thinking, Artificial Intelligence etc... Beginner level, 1 - 3 Months",https://www.coursera.org/learn/artificial-intelligence-education-for-teachers,Coursera
Generative AI for Software Development,"Generative AI for Software Development new Professional Certificate by DeepLearning.AI, 4.6 stars, by 456 reviews, provide skills Database Design, Software Documentation, Software Design Patterns etc... Beginner level, 1 - 3 Months",https://www.coursera.org/professional-certificates/generative-ai-for-software-development,Coursera
Full Stack Web Developer,Not Available,https://www.udacity.com/course/full-stack-web-developer-nanodegree--nd0044,Udacity
"ChatGPT: Excel at Personal Automation with GPTs, AI & Zapier","ChatGPT: Excel at Personal Automation with GPTs, AI & Zapier Specialization by Vanderbilt University, 4.8 stars, by 5.3K reviews, provide skills ChatGPT, Generative AI, OpenAI etc... Beginner level, 3 - 6 Months",https://www.coursera.org/specializations/chatgpt-gpt-zapier-excel-at-automation,Coursera
AI for Professional Communication,"AI for Professional Communication Course by Kennesaw State University, 4.8 stars, by 6 reviews, provide skills Business Correspondence, Target Audience, Business Communication etc... Beginner level, 1 - 4 Weeks",https://www.coursera.org/learn/ai-for-professional-communication,Coursera
Build and Execute an Organisational AI Strategy,"Build and Execute an Organisational AI Strategy free Course by Coursera Instructor Network, 4.6 stars, by 18 reviews, provide skills Organizational Strategy, Governance, Strategic Leadership etc... Intermediate level, 1 - 4 Weeks",https://www.coursera.org/learn/build-and-execute-an-organisational-ai-strategy,Coursera
AI for Creative Work,"AI for Creative Work new Specialization by University of Michigan, 4.8 stars, by 21 reviews, provide skills Data Ethics, Generative AI, Artificial Intelligence etc... Beginner level, 3 - 6 Months",https://www.coursera.org/specializations/ai-for-creative-work,Coursera
AI and Public Health,"AI and Public Health Course by DeepLearning.AI, 4.8 stars, by 216 reviews, provide skills Data Analysis, Jupyter, Exploratory Data Analysis etc... Beginner level, 1 - 4 Weeks",https://www.coursera.org/learn/ai-and-public-health,Coursera
Oracle Cloud Infrastructure AI Foundations,"Oracle Cloud Infrastructure AI Foundations new free Course by Oracle, provide skills Generative AI, Oracle Cloud, Supervised Learning etc... Beginner level, 1 - 4 Weeks",https://www.coursera.org/learn/oracle-cloud-infrastructure-ai-foundations,Coursera
Microsoft Copilot for Marketing,"Microsoft Copilot for Marketing new Specialization by Microsoft, 4.7 stars, by 19 reviews, provide skills Customer Insights, Customer Analysis, Persona Development etc... Beginner level, 1 - 3 Months",https://www.coursera.org/specializations/microsoft-copilotformarketing,Coursera
Front End Web Developer,Not Available,https://www.udacity.com/course/front-end-web-developer-nanodegree--nd0011,Udacity
AI Applications in People Management,"AI Applications in People Management  Course by University of Pennsylvania, 4.8 stars, by 239 reviews, provide skills HR Tech, Human Resources, Data Ethics etc... Mixed level, 1 - 4 Weeks",https://www.coursera.org/learn/wharton-ai-applications-people-management,Coursera
Human Factors in AI,"Human Factors in AI Course by Duke University, 4.7 stars, by 113 reviews, provide skills Data Ethics, Human Computer Interaction, User Experience Design etc... Beginner level, 1 - 4 Weeks",https://www.coursera.org/learn/human-factors-in-artificial-intelligence,Coursera
AI Workflow: Enterprise Model Deployment,"AI Workflow: Enterprise Model Deployment Course by IBM, 4.2 stars, by 53 reviews, provide skills Apache Spark, Data Pipelines, MLOps (Machine Learning Operations) etc... Advanced level, 1 - 4 Weeks",https://www.coursera.org/learn/ibm-ai-workflow-machine-learning-model-deployment,Coursera
ChatGPT & Zapier: Agentic AI for Everyone,"ChatGPT & Zapier: Agentic AI for Everyone Course by Vanderbilt University, 4.7 stars, by 58 reviews, provide skills Generative AI, ChatGPT, Expense Management etc... Beginner level, 1 - 4 Weeks",https://www.coursera.org/learn/agentic-ai-chatgpt-zapier,Coursera
C++,Not Available,https://www.udacity.com/course/c-plus-plus-nanodegree--nd213,Udacity
Microsoft Power BI Data Analyst,"Microsoft Power BI Data Analyst Professional Certificate by Microsoft, 4.6 stars, by 6.5K reviews, provide skills Data Storytelling, Dashboard, Excel Formulas etc... Beginner level, 3 - 6 Months",https://www.coursera.org/professional-certificates/microsoft-power-bi-data-analyst,Coursera
Microsoft Copilot for Sales,"Microsoft Copilot for Sales new Specialization by Microsoft, 5.0 stars, by 6 reviews, provide skills Forecasting, Sales Strategy, Customer Analysis etc... Beginner level, 1 - 3 Months",https://www.coursera.org/specializations/microsoft-copilot-for-sales,Coursera
Microsoft AI & ML Engineering,"Microsoft AI & ML Engineering new Professional Certificate by Microsoft, 4.6 stars, by 57 reviews, provide skills Unsupervised Learning, Generative AI, Data Management etc... Intermediate level, 3 - 6 Months",https://www.coursera.org/professional-certificates/microsoft-ai-and-ml-engineering,Coursera
The AI Awakening: Implications for the Economy and Society,"The AI Awakening: Implications for the Economy and Society Course by Stanford University, 4.7 stars, by 79 reviews, provide skills Generative AI, Workforce Development, OpenAI etc... Beginner level, 1 - 4 Weeks",https://www.coursera.org/learn/ai-awakening,Coursera
Computer Vision,Not Available,https://www.udacity.com/course/computer-vision-nanodegree--nd891,Udacity
Cloud Developer,Not Available,https://www.udacity.com/course/cloud-developer-nanodegree--nd9990,Udacity
Front End Web Developer,Not Available,https://www.udacity.com/course/front-end-web-developer-nanodegree--nd0011,Udacity
React,Not Available,https://www.udacity.com/course/react-nanodegree--nd019,Udacity
AI for Design and Optimization,"AI for Design and Optimization new Course by University of Michigan, 4.1 stars, by 9 reviews, provide skills Artificial Intelligence and Machine Learning (AI/ML), Generative AI, Artificial Intelligence etc... Intermediate level, 1 - 4 Weeks",https://www.coursera.org/learn/ai-for-design-and-optimization,Coursera
Introduction to Generative AI for Software Development,"Introduction to Generative AI for Software Development new Course by DeepLearning.AI, 4.7 stars, by 387 reviews, provide skills ChatGPT, Generative AI, Code Review etc... Beginner level, 1 - 4 Weeks",https://www.coursera.org/learn/introduction-to-generative-ai-for-software-development,Coursera
Leveraging AI for Enhanced Content Creation,"Leveraging AI for Enhanced Content Creation  free Course by Coursera Instructor Network, 4.6 stars, by 103 reviews, provide skills Generative AI, Advertising, Advertising Campaigns etc... Beginner level, 1 - 4 Weeks",https://www.coursera.org/learn/leveraging-ai-for-enhanced-content-creation,Coursera
OpenAI for Beginners: AI Assistants for Project Managers,"OpenAI for Beginners: AI Assistants for Project Managers free Guided Project by Coursera Project Network, 3.3 stars, by 10 reviews, provide skills Generative AI, Application Deployment, Project Management Software etc... Beginner level, Less Than 2 Hours",https://www.coursera.org/projects/openai-for-beginners-ai-assistants-for-project-managers,Coursera
Key Technologies for Business,"Key Technologies for Business Specialization by IBM, 4.7 stars, by 97K reviews, provide skills Cloud Computing Architecture, Cloud Services, Cloud Security etc... Beginner level, 3 - 6 Months",https://www.coursera.org/specializations/key-technologies-for-business,Coursera
Data Engineering with AWS,Not Available,https://www.udacity.com/course/data-engineer-nanodegree--nd027,Udacity
Natural Language Processing,Not Available,https://www.udacity.com/course/natural-language-processing-nanodegree--nd892,Udacity
AI for Good,"AI for Good Specialization by DeepLearning.AI, 4.7 stars, by 446 reviews, provide skills Disaster Recovery, Data Analysis, Jupyter etc... Beginner level, 1 - 3 Months",https://www.coursera.org/specializations/ai-for-good,Coursera
iOS Development with SwiftUI and SwiftData,Not Available,https://www.udacity.com/course/ios-developer-nanodegree--nd003,Udacity
ChatGPT for Beginners: Using AI for Market Research,"ChatGPT for Beginners: Using AI for Market Research Guided Project by Coursera Project Network, 4.4 stars, by 67 reviews, provide skills ChatGPT, Market Research, Market Analysis etc... Beginner level, Less Than 2 Hours",https://www.coursera.org/projects/chatgpt-for-beginners-market-research-ai,Coursera
Meta Social Media Marketing,"Meta Social Media Marketing Professional Certificate by Meta, 4.8 stars, by 21K reviews, provide skills Social Media Management, Social Media Marketing, Social Media etc... Beginner level, 3 - 6 Months",https://www.coursera.org/professional-certificates/facebook-social-media-marketing,Coursera
Data Engineering with AWS,Not Available,https://www.udacity.com/course/data-engineer-nanodegree--nd027,Udacity
AI and Disaster Management,"AI and Disaster Management Course by DeepLearning.AI, 4.7 stars, by 199 reviews, provide skills Disaster Recovery, Image Analysis, Data Ethics etc... Beginner level, 1 - 4 Weeks",https://www.coursera.org/learn/ai-and-disaster-management,Coursera
Product Manager,Not Available,https://www.udacity.com/course/product-manager-nanodegree--nd036,Udacity
Generative AI: Prompt Engineering Basics,"Generative AI: Prompt Engineering Basics Course by IBM, 4.8 stars, by 3K reviews, provide skills ChatGPT, Generative AI, IBM Cloud etc... Beginner level, 1 - 4 Weeks",https://www.coursera.org/learn/generative-ai-prompt-engineering-for-everyone,Coursera
IBM AI Developer,"IBM AI Developer Professional Certificate by IBM, 4.6 stars, by 64K reviews, provide skills Generative AI, Software Development Life Cycle, Unit Testing etc... Beginner level, 3 - 6 Months",https://www.coursera.org/professional-certificates/applied-artifical-intelligence-ibm-watson-ai,Coursera
Introduction to Artificial Intelligence (AI),"Introduction to Artificial Intelligence (AI) Course by IBM, 4.7 stars, by 17K reviews, provide skills Artificial Intelligence, Generative AI, Data Ethics etc... Beginner level, 1 - 4 Weeks",https://www.coursera.org/learn/introduction-to-ai,Coursera
Business Analytics,Not Available,https://www.udacity.com/course/business-analytics-nanodegree--nd098,Udacity
Structuring Machine Learning Projects,"Structuring Machine Learning Projects Course by DeepLearning.AI, 4.8 stars, by 50K reviews, provide skills Deep Learning, Artificial Intelligence and Machine Learning (AI/ML), Applied Machine Learning etc... Beginner level, 1 - 4 Weeks",https://www.coursera.org/learn/machine-learning-projects,Coursera
Computer Vision,Not Available,https://www.udacity.com/course/computer-vision-nanodegree--nd891,Udacity
IBM & Darden Digital Strategy,"IBM & Darden Digital Strategy Specialization by IBM, University of Virginia Darden School Foundation, 4.7 stars, by 42K reviews, provide skills Strategic Thinking, Digital Transformation, Business Strategy etc... Beginner level, 3 - 6 Months",https://www.coursera.org/specializations/digital-strategy,Coursera
Natural Language Processing,Not Available,https://www.udacity.com/course/natural-language-processing-nanodegree--nd892,Udacity
Deep Learning,Not Available,https://www.udacity.com/course/deep-learning-nanodegree--nd101,Udacity
iOS Development with SwiftUI and SwiftData,Not Available,https://www.udacity.com/course/ios-developer-nanodegree--nd003,Udacity
AI in Education: Leveraging ChatGPT for Teaching,"AI in Education: Leveraging ChatGPT for Teaching new Course by University of Pennsylvania, 4.7 stars, by 99 reviews, provide skills Data Ethics, ChatGPT, Generative AI etc... Beginner level, 1 - 4 Weeks",https://www.coursera.org/learn/wharton-ai-in-education-leveraging-chatgpt-for-teaching,Coursera
Deep Learning,Not Available,https://www.udacity.com/course/deep-learning-nanodegree--nd101,Udacity
Data Scientist,Not Available,https://www.udacity.com/course/data-scientist-nanodegree--nd025,Udacity
Natural Language Processing,Not Available,https://www.udacity.com/course/natural-language-processing-nanodegree--nd892,Udacity
AI in Healthcare,"AI in Healthcare Specialization by Stanford University, 4.7 stars, by 2K reviews, provide skills Feature Engineering, Pharmaceuticals, Data Ethics etc... Beginner level, 3 - 6 Months",https://www.coursera.org/specializations/ai-healthcare,Coursera
AI Workflow: AI in Production,"AI Workflow: AI in Production Course by IBM, 4.5 stars, by 49 reviews, provide skills Application Deployment, MLOps (Machine Learning Operations), Unit Testing etc... Advanced level, 1 - 4 Weeks",https://www.coursera.org/learn/ibm-ai-workflow-ai-production,Coursera
ChatGPT Prompt Engineering for Developers,"ChatGPT Prompt Engineering for Developers free Project by DeepLearning.AI, 4.7 stars, by 1.4K reviews, provide skills ChatGPT, OpenAI, Generative AI etc... Beginner level, Less Than 2 Hours",https://www.coursera.org/projects/chatgpt-prompt-engineering-for-developers-project,Coursera
Generative AI for Executives and Business Leaders,"Generative AI for Executives and Business Leaders new Specialization by IBM, 4.7 stars, by 378 reviews, provide skills Risk Mitigation, Generative AI, Risk Analysis etc... Intermediate level, 1 - 4 Weeks",https://www.coursera.org/specializations/generative-ai-for-executives-and-business-leaders,Coursera
Generative AI Essentials: Overview and Impact,"Generative AI Essentials: Overview and Impact Course by University of Michigan, 4.6 stars, by 184 reviews, provide skills ChatGPT, Generative AI, Natural Language Processing etc... Beginner level, 1 - 4 Weeks",https://www.coursera.org/learn/generative-ai-essentials,Coursera
Generative AI with Large Language Models,"Generative AI with Large Language Models Course by DeepLearning.AI, Amazon Web Services, 4.8 stars, by 3.2K reviews, provide skills Generative AI, OpenAI, ChatGPT etc... Intermediate level, 1 - 4 Weeks",https://www.coursera.org/learn/generative-ai-with-llms,Coursera
Digital Marketing,Not Available,https://www.udacity.com/course/digital-marketing-nanodegree--nd018,Udacity
Developing Explainable AI (XAI),"Developing Explainable AI (XAI) new Course by Duke University, 4.5 stars, by 15 reviews, provide skills Data Ethics, Generative AI, Artificial Intelligence etc... Intermediate level, 1 - 4 Weeks",https://www.coursera.org/learn/explainable-ai-xai,Coursera
Data Structures and Algorithms,Not Available,https://www.udacity.com/course/data-structures-and-algorithms-nanodegree--nd256,Udacity
Coding with Generative AI,"Coding with Generative AI Course by Fractal Analytics, 4.4 stars, by 14 reviews, provide skills Generative AI, Object Oriented Programming (OOP), Artificial Neural Networks etc... Intermediate level, 1 - 4 Weeks",https://www.coursera.org/learn/introduction-coding-with-generative-ai,Coursera
AI & Law,"AI & Law  Course by Lund University, 4.7 stars, by 637 reviews, provide skills Law, Regulation, and Compliance, Artificial Intelligence, Labor Law etc... Beginner level, 1 - 4 Weeks",https://www.coursera.org/learn/ai-law,Coursera
"Generative AI: Fundamentals, Applications, and Challenges","Generative AI: Fundamentals, Applications, and Challenges Course by University of Michigan, 4.7 stars, by 51 reviews, provide skills Generative AI, OpenAI, Data Ethics etc... Beginner level, 1 - 4 Weeks",https://www.coursera.org/learn/generative-ai-fundamentals-applications-and-challenges,Coursera
Generative AI for Data Scientists,"Generative AI for Data Scientists Specialization by IBM, 4.7 stars, by 4.6K reviews, provide skills ChatGPT, Generative AI, Exploratory Data Analysis etc... Intermediate level, 1 - 3 Months",https://www.coursera.org/specializations/generative-ai-for-data-scientists,Coursera
Fundamentals of Machine Learning and Artificial Intelligence,"Fundamentals of Machine Learning and Artificial Intelligence free Course by Amazon Web Services, 4.5 stars, by 240 reviews, provide skills Artificial Intelligence and Machine Learning (AI/ML), Generative AI, Deep Learning etc... Mixed level, 1 - 4 Weeks",https://www.coursera.org/learn/fundamentals-of-machine-learning-and-artificial-intelligence,Coursera
Introduction to Programming,Not Available,https://www.udacity.com/course/intro-to-programming-nanodegree--nd000,Udacity
React,Not Available,https://www.udacity.com/course/react-nanodegree--nd019,Udacity
AI Programming with Python,Not Available,https://www.udacity.com/course/ai-programming-python-nanodegree--nd089,Udacity
Generative AI Primer,"Generative AI Primer Course by Vanderbilt University, 4.8 stars, by 255 reviews, provide skills Generative AI, ChatGPT, Artificial Intelligence etc... Beginner level, 1 - 4 Weeks",https://www.coursera.org/learn/generative-ai,Coursera
Generative AI Leadership & Strategy,"Generative AI Leadership & Strategy Specialization by Vanderbilt University, 4.8 stars, by 5.6K reviews, provide skills ChatGPT, Ideation, Verification And Validation etc... Beginner level, 1 - 3 Months",https://www.coursera.org/specializations/generative-ai-leadership-strategy,Coursera
AI for Trading,Not Available,https://www.udacity.com/course/ai-for-trading--nd880,Udacity
OpenAI GPTs: Creating Your Own Custom AI Assistants,"OpenAI GPTs: Creating Your Own Custom AI Assistants Course by Vanderbilt University, 4.9 stars, by 298 reviews, provide skills Generative AI, ChatGPT, OpenAI etc... Beginner level, 1 - 4 Weeks",https://www.coursera.org/learn/openai-custom-gpts,Coursera
IBM Relational Database Administrator,"IBM Relational Database Administrator new Professional Certificate by IBM, 4.6 stars, by 56K reviews, provide skills Data Warehousing, SQL, Extract, Transform, Load etc... Intermediate level, 3 - 6 Months",https://www.coursera.org/professional-certificates/ibm-relational-database-administrator,Coursera
Programming with Generative AI,"Programming with Generative AI Course by Indian Institute of Technology Guwahati, 4.7 stars, by 70 reviews, provide skills Generative AI, GitHub, OpenAI etc... Beginner level, 1 - 4 Weeks",https://www.coursera.org/learn/programming-with-generative-ai,Coursera
Supervised Machine Learning: Regression and Classification,"Supervised Machine Learning: Regression and Classification  Course by DeepLearning.AI, Stanford University, 4.9 stars, by 27K reviews, provide skills Supervised Learning, Applied Machine Learning, Jupyter etc... Beginner level, 1 - 4 Weeks",https://www.coursera.org/learn/machine-learning,Coursera
Introduction to Programming,Not Available,https://www.udacity.com/course/intro-to-programming-nanodegree--nd000,Udacity
Cloud DevOps Engineer,Not Available,https://www.udacity.com/course/cloud-dev-ops-nanodegree--nd9991,Udacity
Generative AI for Software Developers,"Generative AI for Software Developers Specialization by IBM, 4.7 stars, by 4.6K reviews, provide skills ChatGPT, Generative AI, OpenAI etc... Intermediate level, 1 - 3 Months",https://www.coursera.org/specializations/generative-ai-for-software-developers,Coursera
AI for Mechanical Engineers,"AI for Mechanical Engineers new Specialization by University of Michigan, 4.4 stars, by 19 reviews, provide skills Artificial Intelligence and Machine Learning (AI/ML), Generative AI, Machine Learning etc... Intermediate level, 1 - 3 Months",https://www.coursera.org/specializations/ai-for-mechanical-engineers,Coursera
AI For Medical Treatment,"AI For Medical Treatment Course by DeepLearning.AI, 4.7 stars, by 520 reviews, provide skills Deep Learning, Statistical Analysis, Clinical Trials etc... Intermediate level, 1 - 4 Weeks",https://www.coursera.org/learn/ai-for-medical-treatment,Coursera
Business Analytics,Not Available,https://www.udacity.com/course/business-analytics-nanodegree--nd098,Udacity
AI Strategy and Governance,"AI Strategy and Governance Course by University of Pennsylvania, 4.8 stars, by 266 reviews, provide skills Data Ethics, Data Governance, Data Security etc... Beginner level, 1 - 4 Weeks",https://www.coursera.org/learn/wharton-ai-strategy-governance,Coursera
