Title,Description,URL,Tag
Accelerate Your Learning with ChatGPT,"Accelerate Your Learning with ChatGPT free Course by Deep Teaching Solutions, 4.8 stars, by 425 reviews, provide skills Creative Thinking, ChatGPT, Learning Strategies etc... Beginner level, 1 - 4 Weeks",https://www.coursera.org/learn/learning-chatgpt,Coursera
IBM Data Analyst,"IBM Data Analyst Professional Certificate by IBM, 4.6 stars, by 88K reviews, provide skills Data Storytelling, Dashboard, Data Visualization Software etc... Beginner level, 3 - 6 Months",https://www.coursera.org/professional-certificates/ibm-data-analyst,Coursera
Product Manager,Not Available,https://www.udacity.com/course/product-manager-nanodegree--nd036,Udacity
AI and Public Health,"AI and Public Health Course by DeepLearning.AI, 4.8 stars, by 216 reviews, provide skills Data Analysis, Jupyter, Exploratory Data Analysis etc... Beginner level, 1 - 4 Weeks",https://www.coursera.org/learn/ai-and-public-health,Coursera
User Experience,Not Available,https://www.udacity.com/course/ux-designer-nanodegree--nd578,Udacity
Responsible Generative AI,"Responsible Generative AI Specialization by University of Michigan, 4.7 stars, by 84 reviews, provide skills Generative AI, Governance, Data Governance etc... Beginner level, 1 - 3 Months",https://www.coursera.org/specializations/responsible-generative-ai,Coursera
C++,Not Available,https://www.udacity.com/course/c-plus-plus-nanodegree--nd213,Udacity
Computer Vision,Not Available,https://www.udacity.com/course/computer-vision-nanodegree--nd891,Udacity
User Experience,Not Available,https://www.udacity.com/course/ux-designer-nanodegree--nd578,Udacity
Generative AI Fundamentals,"Generative AI Fundamentals Specialization by IBM, 4.7 stars, by 4.8K reviews, provide skills Generative AI, ChatGPT, OpenAI etc... Beginner level, 3 - 6 Months",https://www.coursera.org/specializations/generative-ai-for-everyone,Coursera
Building Agentic RAG with LlamaIndex,"Building Agentic RAG with LlamaIndex free Project by DeepLearning.AI, 4.8 stars, by 39 reviews, provide skills Generative AI, Debugging, Artificial Intelligence etc... Beginner level, Less Than 2 Hours",https://www.coursera.org/projects/building-agentic-rag-with-llamaindex,Coursera
Generative AI with Large Language Models,"Generative AI with Large Language Models Course by DeepLearning.AI, Amazon Web Services, 4.8 stars, by 3.2K reviews, provide skills Generative AI, OpenAI, ChatGPT etc... Intermediate level, 1 - 4 Weeks",https://www.coursera.org/learn/generative-ai-with-llms,Coursera
AI for Decision Makers,"AI for Decision Makers Course by Fred Hutchinson Cancer Center, 4.8 stars, by 10 reviews, provide skills Data Ethics, Human Resource Policies, Technology Strategies etc... Beginner level, 1 - 3 Months",https://www.coursera.org/learn/ai-for-decision-makers,Coursera
Computer Vision,Not Available,https://www.udacity.com/course/computer-vision-nanodegree--nd891,Udacity
Generative AI for Customer Support,"Generative AI for Customer Support new Specialization by IBM, SkillUp EdTech, 4.7 stars, by 4.5K reviews, provide skills ChatGPT, Generative AI, Standard Operating Procedure etc... Intermediate level, 1 - 3 Months",https://www.coursera.org/specializations/generative-ai-for-customer-support,Coursera
C++,Not Available,https://www.udacity.com/course/c-plus-plus-nanodegree--nd213,Udacity
C++,Not Available,https://www.udacity.com/course/c-plus-plus-nanodegree--nd213,Udacity
AI for Medical Diagnosis,"AI for Medical Diagnosis Course by DeepLearning.AI, 4.7 stars, by 2K reviews, provide skills Image Analysis, Predictive Modeling, Risk Modeling etc... Intermediate level, 1 - 4 Weeks",https://www.coursera.org/learn/ai-for-medical-diagnosis,Coursera
Generative AI in Education,"Generative AI in Education Course by University of Glasgow, 4.5 stars, by 66 reviews, provide skills Generative AI, OpenAI, ChatGPT etc... Beginner level, 1 - 4 Weeks",https://www.coursera.org/learn/generative-ai-in-education,Coursera
Data Engineering with AWS,Not Available,https://www.udacity.com/course/data-engineer-nanodegree--nd027,Udacity
Adobe Marketing Specialist,"Adobe Marketing Specialist new Professional Certificate by Adobe, 4.6 stars, by 378 reviews, provide skills Content Marketing, Promotional Strategies, Social Media Content etc... Beginner level, 3 - 6 Months",https://www.coursera.org/professional-certificates/adobe-marketing-specialist,Coursera
Microsoft Generative AI for Data Analysis,"Microsoft Generative AI for Data Analysis new Professional Certificate by Microsoft, 4.2 stars, by 39 reviews, provide skills Data Storytelling, Data Presentation, Dashboard etc... Intermediate level, 3 - 6 Months",https://www.coursera.org/professional-certificates/microsoft-genai-for-data-analysis,Coursera
Full Stack Web Developer,Not Available,https://www.udacity.com/course/full-stack-web-developer-nanodegree--nd0044,Udacity
Microsoft Azure AI Fundamentals AI-900 Exam Prep,"Microsoft Azure AI Fundamentals AI-900 Exam Prep Specialization by Microsoft, 4.6 stars, by 1K reviews, provide skills Anomaly Detection, Image Analysis, Text Mining etc... Beginner level, 3 - 6 Months",https://www.coursera.org/specializations/microsoft-azure-ai-900-ai-fundamentals,Coursera
Data Structures and Algorithms,Not Available,https://www.udacity.com/course/data-structures-and-algorithms-nanodegree--nd256,Udacity
Full Stack Web Developer,Not Available,https://www.udacity.com/course/full-stack-web-developer-nanodegree--nd0044,Udacity
Deep Learning,Not Available,https://www.udacity.com/course/deep-learning-nanodegree--nd101,Udacity
Generative AI for Human Resources (HR) Professionals,"Generative AI for Human Resources (HR) Professionals Specialization by IBM, SkillUp EdTech, 4.7 stars, by 4.5K reviews, provide skills ChatGPT, Generative AI, HR Tech etc... Intermediate level, 1 - 3 Months",https://www.coursera.org/specializations/generative-ai-for-human-resources,Coursera
User Experience,Not Available,https://www.udacity.com/course/ux-designer-nanodegree--nd578,Udacity
Foundations of AI and Machine Learning,"Foundations of AI and Machine Learning new Course by Microsoft, 4.6 stars, by 51 reviews, provide skills Data Management, Artificial Intelligence and Machine Learning (AI/ML), Infrastructure Architecture etc... Intermediate level, 1 - 3 Months",https://www.coursera.org/learn/foundations-of-ai-and-machine-learning,Coursera
AI Foundations for Everyone,"AI Foundations for Everyone Specialization by IBM, 4.7 stars, by 23K reviews, provide skills ChatGPT, Generative AI, Artificial Intelligence etc... Beginner level, 3 - 6 Months",https://www.coursera.org/specializations/ai-foundations-for-everyone,Coursera
iOS Development with SwiftUI and SwiftData,Not Available,https://www.udacity.com/course/ios-developer-nanodegree--nd003,Udacity
Generative AI for Executives,"Generative AI for Executives free Course by Amazon Web Services, 3.7 stars, by 18 reviews, provide skills Amazon Web Services, Emerging Technologies, Business Transformation etc... Beginner level, 1 - 4 Weeks",https://www.coursera.org/learn/generative-ai-for-executives,Coursera
"AI, Empathy & Ethics","AI, Empathy & Ethics free Course by University of California, Santa Cruz, 4.5 stars, by 263 reviews, provide skills Data Ethics, Artificial Intelligence, Artificial Neural Networks etc... Beginner level, 1 - 4 Weeks",https://www.coursera.org/learn/ai-empathy-ethics,Coursera
Navigating Generative AI for Leaders,"Navigating Generative AI for Leaders Specialization by Coursera, 4.8 stars, by 141 reviews, provide skills Generative AI, Strategic Thinking, Data Ethics etc... Beginner level, 1 - 3 Months",https://www.coursera.org/specializations/navigating-generative-ai-for-leaders,Coursera
Applied Data Science,"Applied Data Science Specialization by IBM, 4.6 stars, by 57K reviews, provide skills Dashboard, Data Visualization Software, Plotly etc... Beginner level, 3 - 6 Months",https://www.coursera.org/specializations/applied-data-science,Coursera
Generative AI with Large Language Models,"Generative AI with Large Language Models Course by DeepLearning.AI, Amazon Web Services, 4.8 stars, by 3.2K reviews, provide skills Generative AI, OpenAI, ChatGPT etc... Intermediate level, 1 - 4 Weeks",https://www.coursera.org/learn/generative-ai-with-llms,Coursera
Full Stack Web Developer,Not Available,https://www.udacity.com/course/full-stack-web-developer-nanodegree--nd0044,Udacity
AI for Trading,Not Available,https://www.udacity.com/course/ai-for-trading--nd880,Udacity
Data Engineering with AWS,Not Available,https://www.udacity.com/course/data-engineer-nanodegree--nd027,Udacity
IBM Full Stack Software Developer,"IBM Full Stack Software Developer Professional Certificate by IBM, 4.6 stars, by 53K reviews, provide skills Istio, Node.JS, Software Development Life Cycle etc... Beginner level, 3 - 6 Months",https://www.coursera.org/professional-certificates/ibm-full-stack-cloud-developer,Coursera
AI Materials,"AI Materials free Course by Korea Advanced Institute of Science and Technology(KAIST), 4.8 stars, by 34 reviews, provide skills Artificial Intelligence and Machine Learning (AI/ML), Artificial Intelligence, Human Machine Interfaces etc... Beginner level, 1 - 3 Months",https://www.coursera.org/learn/ai-materials,Coursera
Intel® AI Fundamentals,"Intel® AI Fundamentals Specialization by Intel, 4.1 stars, by 66 reviews, provide skills Artificial Intelligence, Business Technologies, Complex Problem Solving etc... Beginner level, 1 - 4 Weeks",https://www.coursera.org/specializations/intel-ai-fundamental,Coursera
Generative AI for Educators & Teachers,"Generative AI for Educators & Teachers Specialization by Vanderbilt University, 4.8 stars, by 1.2K reviews, provide skills Generative AI, ChatGPT, Ideation etc... Beginner level, 1 - 3 Months",https://www.coursera.org/specializations/generative-ai-for-educators-teachers,Coursera
AI Programming with Python,Not Available,https://www.udacity.com/course/ai-programming-python-nanodegree--nd089,Udacity
Data Scientist,Not Available,https://www.udacity.com/course/data-scientist-nanodegree--nd025,Udacity
"Python for Data Science, AI & Development","Python for Data Science, AI & Development Course by IBM, 4.6 stars, by 40K reviews, provide skills Jupyter, Automation, Web Scraping etc... Beginner level, 1 - 3 Months",https://www.coursera.org/learn/python-for-applied-data-science-ai,Coursera
Responsible AI: Applying AI Principles with Google Cloud,"Responsible AI: Applying AI Principles with Google Cloud Course by Google Cloud, 4.5 stars, by 401 reviews, provide skills Data Ethics, Artificial Intelligence, Business Ethics etc... Beginner level, 1 - 3 Months",https://www.coursera.org/learn/responsible-ai-applying-ai-principles-with-google-cloud,Coursera
Data Analyst,Not Available,https://www.udacity.com/course/data-analyst-nanodegree--nd002,Udacity
Trustworthy AI for Healthcare Management,"Trustworthy AI for Healthcare Management free Course by Politecnico di Milano, 4.7 stars, by 57 reviews, provide skills Data Ethics, Artificial Intelligence, Healthcare Industry Knowledge etc... Beginner level, 1 - 3 Months",https://www.coursera.org/learn/trustworthy-ai-for-healthcare-management,Coursera
Vertex AI Search for Retail,"Vertex AI Search for Retail Specialization by Google Cloud, 4.6 stars, by 16K reviews, provide skills Dataflow, Google Cloud Platform, Data Pipelines etc... Beginner level, 3 - 6 Months",https://www.coursera.org/specializations/vertex-ai-search-for-retail,Coursera
Cloud DevOps Engineer,Not Available,https://www.udacity.com/course/cloud-dev-ops-nanodegree--nd9991,Udacity
Data Scientist,Not Available,https://www.udacity.com/course/data-scientist-nanodegree--nd025,Udacity
Introduction to Programming,Not Available,https://www.udacity.com/course/intro-to-programming-nanodegree--nd000,Udacity
Front End Web Developer,Not Available,https://www.udacity.com/course/front-end-web-developer-nanodegree--nd0011,Udacity
Business Analytics,Not Available,https://www.udacity.com/course/business-analytics-nanodegree--nd098,Udacity
Programming for Data Science with Python,Not Available,https://www.udacity.com/course/programming-for-data-science-nanodegree--nd104,Udacity
"AI Ethics, Responsible Use, and Creativity","AI Ethics, Responsible Use, and Creativity new Course by University of Michigan, 4.9 stars, by 11 reviews, provide skills Data Ethics, Artificial Intelligence, Generative AI etc... Beginner level, 1 - 3 Months",https://www.coursera.org/learn/ai-ethics-responsible-use-and-creativity,Coursera
